{
  "ver": "1.3.0",
  "nam": {
    "fn": "ابو بكر محمد بن زكريا الرازي",
    "fnt": "ABW<BKR<MXHMD<BN<ZKRYA<ALRAZY",
    "gn": "ناصر",
    "gnt": "NAXSSR"
  },
  "dob": "1964-01-01",
  "t": [
    {
      "tg": "840539006",
      "tt": "LP6464-4",
      "nm": "ELITechGroup, SARS-CoV-2 ELITe MGB® Kit",
      "sc": "2021-06-11T17:30:00Z",
      "tr": "260415000",
      "tc": "Example Test Corp, Big City",
      "co": "NL",
      "is": "Ministry of Health Welfare and Sport",
      "ci": "URN:UVCI:01:NL:DADFCC47C7334E45A906DB12FD859FB7#1"
    }
  ]
}
