{
  "ver": "1.3.0",
  "nam": {
    "fn": "ابو بكر محمد بن زكريا الرازي",
    "fnt": "ABW<BKR<MXHMD<BN<ZKRYA<ALRAZY",
    "gn": "ناصر",
    "gnt": "NAXSSR"
  },
  "dob": "1964-01-01",
  "r": [
    {
      "tg": "840539006",
      "fr": "2021-06-01",
      "co": "NL",
      "is": "Ministry of Health Welfare and Sport",
      "df": "2021-06-12",
      "du": "2021-11-28",
      "ci": "URN:UVCI:01:NL:DADFCC47C7334E45A906DB12FD859FB7#1"
    }
  ]
}
