{
  "ver": "1.3.0",
  "nam": {
    "fn": "Li",
    "fnt": "LI"
  },
  "dob": "1970",
  "v": [
    {
      "tg": "840539006",
      "vp": "1119305005",
      "mp": "EU/1/20/1525",
      "ma": "ORG-100001417",
      "dn": 1,
      "sd": 1,
      "dt": "2021-06-11",
      "co": "NL",
      "is": "Ministry of Health Welfare and Sport",
      "ci": "01:NL:1312D00"
    }
  ]
}
