{
  "ver": "1.3.0",
  "nam": {
    "fn": "Li",
    "fnt": "LI"
  },
  "dob": "1970",
  "r": [
    {
      "tg": "840539006",
      "fr": "2021-01-01",
      "co": "NL",
      "is": "Ministry of Health Welfare and Sport",
      "df": "2021-06-12",
      "du": "2021-11-28",
      "ci": "01:NL:1312D00"
    }
  ]
}
