{
  "ver": "1.3.0",
  "nam": {
    "fn": "Smith-Jones",
    "fnt": "SMITH<JONES",
    "gn": "Charles Edward",
    "gnt": "CHARLES<EDWARD"
  },
  "dob": "1964-01",
  "r": [
    {
      "tg": "840539006",
      "fr": "2021-06-01",
      "co": "UNHCR",
      "is": "United Nations HCR",
      "df": "2021-06-12",
      "du": "2021-11-28",
      "ci": "URN#UVCI#01#NL#DADFCC47C7334E45A906DB12FD859FB7"
    }
  ]
}
